<!-- $Id$ -->

<!ELEMENT egaPalette ( color+ ) >

<!ELEMENT color EMPTY >
<!ATTLIST color r                 NMTOKEN  #REQUIRED
                g                 NMTOKEN  #REQUIRED
                b                 NMTOKEN  #REQUIRED>
